 "concept" , "prefLabelNl" , "definitionNl" ,
 "http://ilearn.ilabt.imec.be/vocab/curr1/s-1-communicatie" , "communicatie (andere talen)" , "Vreemde talen receptief, productief en interactief, zowel mondeling als schriftelijk gebruiken als communicatiemiddelen in relevante situaties." ,
 "http://ilearn.ilabt.imec.be/vocab/curr1/s-1-literatuur" , "literatuur (andere talen)" , "Literatuur in vreemde talen beleven." ,
 "http://ilearn.ilabt.imec.be/vocab/curr1/s-1-taal-en-cultuur" , "taal en cultuur (andere talen)" , "Inzicht hebben in vreemde talen als exponenten en delen van culturen en maatschappijen." ,
 "http://ilearn.ilabt.imec.be/vocab/curr1/s-1-taalsysteem" , "taalsysteem (andere talen)" , "Kenmerken en principes van vreemde talen begrijpen om ze in te zetten bij het communiceren." ,
 "http://ilearn.ilabt.imec.be/vocab/curr1/s-biologie" , "levende systemen" , "Inzicht ontwikkelen in de basiseigenschappen van levende systemen." ,
 "http://ilearn.ilabt.imec.be/vocab/curr1/s-bronnenkritiek" , "historische bronnenkritiek" , "Kritisch reflecteren met en over historische bronnen." ,
 "http://ilearn.ilabt.imec.be/vocab/curr1/s-chemie" , "materie (bouw, structuur, eigenschappen)" , "Inzicht ontwikkelen in de bouw, structuur en eigenschappen van materie in levende en niet-levende systemen." ,
 "http://ilearn.ilabt.imec.be/vocab/curr1/s-communicatie" , "communicatie (Nederlands)" , "Het Nederlands receptief, productief en interactief, zowel mondeling als schriftelijk gebruiken als communicatiemiddel in relevante situaties." ,
 "http://ilearn.ilabt.imec.be/vocab/curr1/s-computers-en-systemen" , "computers en systemen" , "Computationeel denken en handelen." ,
 "http://ilearn.ilabt.imec.be/vocab/curr1/s-democratie-en-mensenrechten" , "democratie en mensenrechten" , "Democratische principes en democratische cultuur kaderen binnen de moderne rechtsstaat." ,
 "http://ilearn.ilabt.imec.be/vocab/curr1/s-dialoog" , "dialoog" , "Geïnformeerd en beargumenteerd met elkaar in dialoog gaan." ,
 "http://ilearn.ilabt.imec.be/vocab/curr1/s-digitale-media-en-toepassingen" , "digitale media en toepassingen" , "Digitale media en toepassingen gebruiken om te creëren, te participeren en te interageren." ,
 "http://ilearn.ilabt.imec.be/vocab/curr1/s-diversiteit" , "diversiteit" , "Omgaan met diversiteit in het samenleven en het samenwerken." ,
 "http://ilearn.ilabt.imec.be/vocab/curr1/s-economie" , "algemene economie" , "Reflecteren over de werking van de markten en de economie als systeem en de invloed van de overheid hierop duiden binnen de (inter)nationale context." ,
 "http://ilearn.ilabt.imec.be/vocab/curr1/s-ethiek" , "ethiek" ,  ,
 "http://ilearn.ilabt.imec.be/vocab/curr1/s-filosofie" , "filosofie" ,  ,
 "http://ilearn.ilabt.imec.be/vocab/curr1/s-fysica" , "energie en materie (interacties)" , "Inzicht ontwikkelen in de verschijningsvormen van energie, de wisselwerking tussen materie onderling en met energie alsook de gevolgen ervan." ,
 "http://ilearn.ilabt.imec.be/vocab/curr1/s-geld-en-consumptie" , "geld en budget" , "Inzicht ontwikkelen in consumptiegedrag, inkomensverwerving en financiële producten om budgettaire gevolgen op korte en lange termijn in te schatten." ,
 "http://ilearn.ilabt.imec.be/vocab/curr1/s-gezonde-levensstijl" , "gezonde levensstijl" , "Een gezonde levensstijl opbouwen, onderhouden en versterken." ,
 "http://ilearn.ilabt.imec.be/vocab/curr1/s-historische-beeldvorming" , "historische beeldvorming" , "Tot beargumenteerde historische beeldvorming komen vanuit verschillende perspectieven." ,
 "http://ilearn.ilabt.imec.be/vocab/curr1/s-historische-dynamieken" , "verleden en heden" , "Over de complexe relatie tussen verleden, heden en toekomst reflecteren en deze duiden." ,
 "http://ilearn.ilabt.imec.be/vocab/curr1/s-historische-tijdlijn" , "historisch referentiekader" , "Historische fenomenen situeren in een historisch referentiekader." ,
 "http://ilearn.ilabt.imec.be/vocab/curr1/s-identiteit" , "identiteit" , "De dynamiek en de gelaagdheid van (eigen) identiteiten duiden." ,
 "http://ilearn.ilabt.imec.be/vocab/curr1/s-informatie-verwerven" , "informatie verwerven en verwerken" , "Geschikte (leer-)activiteiten, strategieën en tools inzetten om informatie digitaal en niet-digitaal kritisch te verwerven, beheren en verwerken rekening houdend met het beoogde leerresultaat en –proces." ,
 "http://ilearn.ilabt.imec.be/vocab/curr1/s-keuzes-maken" , "keuzes maken" , "(Duurzame) keuzes maken, rekening houdend met gevolgen op korte en lange termijn." ,
 "http://ilearn.ilabt.imec.be/vocab/curr1/s-kunstbeleving-en-waardering" , "cultuur beleven en waarderen" , "Uitingen van kunst en cultuur beleven en de waardering ervoor duiden." ,
 "http://ilearn.ilabt.imec.be/vocab/curr1/s-kunstconcepten" , "cultuur waarnemen en conceptualiseren" , "Uitingen van kunst en cultuur waarnemen en conceptualiseren." ,
 "http://ilearn.ilabt.imec.be/vocab/curr1/s-kunstcreatie" , "artistiek werk creëren" , "Verbeelding gericht inzetten bij het creëren van artistiek werk." ,
 "http://ilearn.ilabt.imec.be/vocab/curr1/s-kunstgeschiedenis-en-kunststromingen" , "cultuur contextualiseren" , "Uitingen van kunst en cultuur duiden in relatie tot de maatschappelijke,  historische en geografische context waarin ze zich manifesteren." ,
 "http://ilearn.ilabt.imec.be/vocab/curr1/s-landschap-en-plaats" , "plaatsbegrip" , "Plaatsbegrip hanteren om lokale, nationale en internationale gebeurtenissen in een geografisch kader te plaatsen." ,
 "http://ilearn.ilabt.imec.be/vocab/curr1/s-leren-leren" , "reflecteren over leren" , "Zichzelf als lerende begrijpen en positioneren ten aanzien van leren in het algemeen en van specifieke leerdomeinen." ,
 "http://ilearn.ilabt.imec.be/vocab/curr1/s-literatuur" , "literatuur (Nederlands)" , "Literatuur in het Nederlands beleven." ,
 "http://ilearn.ilabt.imec.be/vocab/curr1/s-maatschappijkritisch-denken" , "duurzaamheid en systeemdenken" , "De wederzijdse invloed tussen maatschappelijke domeinen en ontwikkelingen en de impact ervan op de (globale) samenleving en het individu kritisch benaderen." ,
 "http://ilearn.ilabt.imec.be/vocab/curr1/s-mediawijsheid" , "mediawijsheid" , "Verantwoord, kritisch en ethisch omgaan met digitale en niet-digitale media en informatie." ,
 "http://ilearn.ilabt.imec.be/vocab/curr1/s-mens-en-leefomgeving" , "mens en aarde (interacties)" , "Ruimtelijke patronen en processen aan het aardoppervlak verklaren als het resultaat van interacties tussen natuurlijke processen onderling, tussen menselijke processen onderling en tussen natuurlijke en menselijke processen." ,
 "http://ilearn.ilabt.imec.be/vocab/curr1/s-mentaal-welbevinden" , "mentaal welbevinden" , "Het mentaal welbevinden opbouwen, onderhouden en versterken." ,
 "http://ilearn.ilabt.imec.be/vocab/curr1/s-ondernemen-en-organisatie" , "onderneming en organisatie" , "De werking van ondernemingen en organisaties en hun maatschappelijke rol duiden." ,
 "http://ilearn.ilabt.imec.be/vocab/curr1/s-onderzoeken" , "onderzoeken en probleemoplossen" , "Een (onderzoeks-)probleem (v)erkennen en een antwoord of oplossing zoeken gebruikmakend van geschikte (leer-)activiteiten, strategieën en tools." ,
 "http://ilearn.ilabt.imec.be/vocab/curr1/s-opportuniteiten-verkennen" , "opportuniteiten verkennen" , "Opportuniteiten zien en verkennen met behulp van een creatief denkproces." ,
 "http://ilearn.ilabt.imec.be/vocab/curr1/s-participatie" , "participatie" , "Actief participeren aan de samenleving, rekening houdend met de rechten en plichten van iedereen binnen de rechtsstaat." ,
 "http://ilearn.ilabt.imec.be/vocab/curr1/s-politiek" , "democratische besluitvorming" , "Democratische besluitvorming op lokaal, nationaal en internationaal niveau duiden" ,
 "http://ilearn.ilabt.imec.be/vocab/curr1/s-reguleren" , "reguleren van het leren" , "Leeropvattingen, -proces en -resultaten reguleren." ,
 "http://ilearn.ilabt.imec.be/vocab/curr1/s-relaties" , "relaties" , "Interpersoonlijke relaties opbouwen, onderhouden en versterken." ,
 "http://ilearn.ilabt.imec.be/vocab/curr1/s-religie-en-geloof" , "religie en geloof" ,  ,
 "http://ilearn.ilabt.imec.be/vocab/curr1/s-ruimte-en-tijd" , "situeren in ruimte en tijd" , "Personen, plaatsen, patronen en processen situeren op verschillende ruimtelijke schaalniveaus en tijdsschalen." ,
 "http://ilearn.ilabt.imec.be/vocab/curr1/s-ruimtelijk-onderzoek" , "geografische methoden en technieken" , "Geografische methoden en technieken aanwenden om ruimtelijke patronen en processen te onderzoeken." ,
 "http://ilearn.ilabt.imec.be/vocab/curr1/s-samenwerken" , "samenleren" , "Samen het leerproces vormgeven." ,
 "http://ilearn.ilabt.imec.be/vocab/curr1/s-sport-en-beweging" , "sport en beweging" , "Een fysiek actieve levensstijl opbouwen, onderhouden en versterken" ,
 "http://ilearn.ilabt.imec.be/vocab/curr1/s-stem-onderzoek" , "multi- en interdisciplinaire STEM-vaardigheden" , "Natuurwetenschappelijke, technologische en wiskundige concepten en methoden inzetten om problemen op te lossen en om objecten, systemen en hun interacties te onderzoeken en te begrijpen." ,
 "http://ilearn.ilabt.imec.be/vocab/curr1/s-taal-en-cultuur" , "taal en cultuur (Nederlands)" , "Inzicht hebben in taal, in het bijzonder het Nederlands, als exponent en deel van een cultuur en een maatschappij." ,
 "http://ilearn.ilabt.imec.be/vocab/curr1/s-taalsysteem" , "taalsysteem (Nederlands)" , "Kenmerken en principes van het Nederlands begrijpen om ze in te zetten bij het communiceren." ,
 "http://ilearn.ilabt.imec.be/vocab/curr1/s-technologie-en-technieken" , "technologie en technieken" , "Technische systemen ontwerpen, realiseren, in gebruik nemen en evalueren rekening houdend met fundamentele maatschappelijke, wetenschappelijke en technologische aspecten." ,
 "http://ilearn.ilabt.imec.be/vocab/curr1/s-technologisch-inzicht" , "technologisch inzicht" , "Inzicht ontwikkelen in technische systemen en processen en hun relatie tot verschillende technologische domeinen en tot andere domeinen (wetenschappen, wiskunde …)." ,
 "http://ilearn.ilabt.imec.be/vocab/curr1/s-uitvoeringsanalyse" , "uitvoeringsanalyse" , "De uitvoerbaarheid van ideeën onderzoeken, het inzetten van middelen tegenover doelstellingen afwegen en het gekozen idee realiseren." ,
 "http://ilearn.ilabt.imec.be/vocab/curr1/s-vaktaal" , "vaktaal" , "Domeinspecifieke terminologie, symbolen en voorstellingen hanteren." ,
 "http://ilearn.ilabt.imec.be/vocab/curr1/s-veiligheid" , "veilige levensstijl" , "Een veilige levensstijl realiseren door het correct inschatten van risicofactoren" ,
 "http://ilearn.ilabt.imec.be/vocab/curr1/s-wiskunde-algebra-analyse" , "algebra, analyse en discrete structuren" , "Inzicht ontwikkelen in en omgaan met relatie en verandering: zoals algebra, analyse en discrete structuren." ,
 "http://ilearn.ilabt.imec.be/vocab/curr1/s-wiskunde-getallenleer" , "getallenleer" , "Inzicht ontwikkelen in en omgaan met getallen en hoeveelheden: getallenleer." ,
 "http://ilearn.ilabt.imec.be/vocab/curr1/s-wiskunde-kansrekenen-statistiek" , "kansrekenen, statistiek" , "Inzicht ontwikkelen in en omgaan met data en onzekerheid: zoals kansrekenen en statistiek." ,
 "http://ilearn.ilabt.imec.be/vocab/curr1/s-wiskunde-meetkunde-en-metend-rekenen" , "meetkunde en metend rekenen" , "Inzicht ontwikkelen in en omgaan met ruimte en vorm: meetkunde en metend rekenen." ,
 "http://ilearn.ilabt.imec.be/vocab/curr1/s-wiskunde-modelleren-en-heuristiek" , "modelleren en problemen oplossen" , "Modelleren en problemen oplossen door analyseren, (de)mathematiseren of aanwenden van heuristieken." ,
 "http://ilearn.ilabt.imec.be/vocab/curr1/s-wiskunde-redeneren" , "redeneren en abstraheren" , "Redeneringen opbouwen en abstraheren rekening houdend met de samenhang en structuur van wiskunde." ,
